{
  "id": "lead_dallas_hvac_001",
  "slug": "example-comfort-hvac-dallas",
  "name": "Example Comfort HVAC",
  "category": "HVAC Contractor",
  "location": {
    "city": "Dallas",
    "stateRegion": "TX",
    "country": "United States"
  },
  "sources": [
    {
      "provider": "example-provider",
      "providerId": "example-business-id",
      "retrievedAt": "2026-10-18T10:00:00Z",
      "notes": "Illustrative sample data only; not a real business record."
    }
  ],
  "businessSignals": {
    "rating": 4.8,
    "reviewCount": 96,
    "activeConfidence": 0.92,
    "observations": [
      "Example activity signal for schema demonstration only."
    ]
  },
  "website": {
    "status": "none",
    "auditedAt": "2026-10-18T10:05:00Z",
    "observations": [
      "No website URL was present in this illustrative source record."
    ],
    "opportunities": [
      "Create a mobile-friendly call and quote-request path."
    ],
    "evidence": [
      "example-provider record"
    ]
  },
  "contacts": [
    {
      "channel": "email",
      "value": "example@example.invalid",
      "label": "Illustrative business email",
      "source": "example-provider",
      "publicBusinessContact": true,
      "confidence": 0.9
    }
  ],
  "assets": [],
  "research": {
    "summary": "Illustrative HVAC lead used to demonstrate the canonical record shape.",
    "customerJourney": "Potential customers may want a quick way to call or request service.",
    "conversionOpportunity": "A concise mobile site could make contact and quote requests easier.",
    "uncertainties": [],
    "lastResearchedAt": "2026-10-18T10:10:00Z"
  },
  "qualification": {
    "score": 88,
    "confidence": 0.86,
    "recommendation": "high",
    "positiveFactors": [
      "No website in the illustrative source record",
      "Strong example reputation/activity signal",
      "Service category commonly depends on calls/quote requests",
      "Public example contact route available"
    ],
    "penalties": [],
    "reason": "Strong illustrative candidate for a demo-first personal outreach workflow.",
    "recommendedChannel": "email",
    "outreachAngle": "Show a mobile call/quote-focused preview.",
    "scoredAt": "2026-10-18T10:12:00Z",
    "scoringVersion": "example-v1"
  },
  "generatedSite": {
    "template": "home-services",
    "hero": {
      "headline": "Illustrative HVAC Preview",
      "subheadline": "Sample presentation copy — replace with verified business-specific copy."
    },
    "services": [],
    "about": "This is intentionally generic sample content. Production generation must use verified facts.",
    "faqs": [],
    "cta": {
      "type": "call_or_quote"
    },
    "generatedAt": "2026-10-18T10:15:00Z",
    "generationVersion": "example-v1"
  },
  "preview": {
    "slug": "example-comfort-hvac-dallas",
    "version": 1,
    "status": "qa_required",
    "generatedAt": "2026-10-18T10:16:00Z"
  },
  "humanReview": {
    "decision": "pending"
  },
  "outreach": {
    "suppressed": false,
    "recommendedChannel": "email",
    "draft": "Hi Example Comfort HVAC team — this is placeholder sample text only.",
    "events": []
  },
  "sales": {
    "stage": "none",
    "objections": []
  },
  "customer": {
    "isCustomer": false,
    "accountHealth": "unknown"
  },
  "maintenance": {
    "openTasks": []
  },
  "lifecycle": "review",
  "experiment": {
    "market": "Dallas–Fort Worth, US",
    "niche": "HVAC",
    "cohort": "validation-example",
    "variant": "personal-email-demo-first"
  },
  "createdAt": "2026-10-18T10:00:00Z",
  "updatedAt": "2026-10-18T10:16:00Z"
}